[
  {
    "id": "worktrunk",
    "title": "Worktrunk",
    "kind": "tool",
    "source": "https://github.com/max-sixty/worktrunk",
    "needs": [
      "parallel_work"
    ],
    "platforms": [],
    "cost": "unknown",
    "privacy": "unknown",
    "equivalence": null,
    "purpose": "Specialist CLI for managing worktrees in parallel coding-agent workflows.",
    "limitations": [
      "tool compatibility and command effects need a version-specific review",
      "Source purpose reviewed only; no integration or demonstrated project benefit is certified."
    ],
    "review_status": "reviewed",
    "review_revision": "purpose-review-2026-09-18",
    "reviewed_at": 1789689600,
    "fresh_for_seconds": 2592000,
    "license_scope": "Link and original short metadata only. Upstream content is not redistributed; resource-specific license permission must be checked before adoption.",
    "adoption_mode": "reference_only"
  },
  {
    "id": "entire",
    "title": "Entire CLI",
    "kind": "tool",
    "source": "https://github.com/entireio/cli",
    "needs": [
      "decision_context",
      "continuity"
    ],
    "platforms": [],
    "cost": "unknown",
    "privacy": "unknown",
    "equivalence": null,
    "purpose": "Records coding-agent session provenance alongside Git checkpoints.",
    "limitations": [
      "recording may retain prompts; inspect its retention and privacy configuration",
      "Source purpose reviewed only; no integration or demonstrated project benefit is certified."
    ],
    "review_status": "reviewed",
    "review_revision": "purpose-review-2026-09-18",
    "reviewed_at": 1789689600,
    "fresh_for_seconds": 2592000,
    "license_scope": "Link and original short metadata only. Upstream content is not redistributed; resource-specific license permission must be checked before adoption.",
    "adoption_mode": "reference_only"
  },
  {
    "id": "codbash",
    "title": "Codbash",
    "kind": "tool",
    "source": "https://github.com/vakovalskii/codbash",
    "needs": [
      "continuity",
      "session_navigation"
    ],
    "platforms": [],
    "cost": "unknown",
    "privacy": "unknown",
    "equivalence": null,
    "purpose": "Cross-agent session navigation and management project.",
    "limitations": [
      "Workstation does not certify session formats, conversion, or Windows behavior",
      "Source purpose reviewed only; no integration or demonstrated project benefit is certified."
    ],
    "review_status": "reviewed",
    "review_revision": "purpose-review-2026-09-18",
    "reviewed_at": 1789689600,
    "fresh_for_seconds": 2592000,
    "license_scope": "Link and original short metadata only. Upstream content is not redistributed; resource-specific license permission must be checked before adoption.",
    "adoption_mode": "reference_only"
  },
  {
    "id": "context7",
    "title": "Context7",
    "kind": "mcp_server",
    "source": "https://github.com/upstash/context7",
    "needs": [
      "current_documentation"
    ],
    "platforms": [],
    "cost": "unknown",
    "privacy": "unknown",
    "equivalence": null,
    "purpose": "Documentation retrieval integration for supported libraries and frameworks.",
    "limitations": [
      "network disclosure and service account requirements need review before connection",
      "Source purpose reviewed only; no integration or demonstrated project benefit is certified."
    ],
    "review_status": "reviewed",
    "review_revision": "purpose-review-2026-09-18",
    "reviewed_at": 1789689600,
    "fresh_for_seconds": 2592000,
    "license_scope": "Link and original short metadata only. Upstream content is not redistributed; resource-specific license permission must be checked before adoption.",
    "adoption_mode": "reference_only"
  },
  {
    "id": "agent-skills-spec",
    "title": "Agent Skills specification",
    "kind": "documentation",
    "source": "https://agentskills.io/specification",
    "needs": [
      "skill_discovery"
    ],
    "platforms": [
      "platform_neutral"
    ],
    "cost": "not_applicable",
    "privacy": "local",
    "equivalence": null,
    "purpose": "Defines packaging and structure for interoperable agent skills.",
    "limitations": [
      "a valid skill package is not proof of safe behavior",
      "Source purpose reviewed only; no integration or demonstrated project benefit is certified."
    ],
    "review_status": "reviewed",
    "review_revision": "purpose-review-2026-09-18",
    "reviewed_at": 1789689600,
    "fresh_for_seconds": 2592000,
    "license_scope": "Link and original short metadata only. Upstream content is not redistributed; resource-specific license permission must be checked before adoption.",
    "adoption_mode": "reference_only"
  },
  {
    "id": "vercel-skills",
    "title": "Vercel agent skills",
    "kind": "skill",
    "source": "https://github.com/vercel-labs/agent-skills",
    "needs": [
      "interface_review",
      "accessibility_review"
    ],
    "platforms": [],
    "cost": "unknown",
    "privacy": "unknown",
    "equivalence": null,
    "purpose": "Collection with web-interface and framework guidance for coding agents.",
    "limitations": [
      "select and review a specific skill revision; a repository-wide review does not certify scripts",
      "Source purpose reviewed only; no integration or demonstrated project benefit is certified."
    ],
    "review_status": "reviewed",
    "review_revision": "purpose-review-2026-09-18",
    "reviewed_at": 1789689600,
    "fresh_for_seconds": 2592000,
    "license_scope": "Link and original short metadata only. Upstream content is not redistributed; resource-specific license permission must be checked before adoption.",
    "adoption_mode": "reference_only"
  },
  {
    "id": "wcag-quickref",
    "title": "WCAG 2.2 quick reference",
    "kind": "documentation",
    "source": "https://www.w3.org/WAI/WCAG22/quickref/",
    "needs": [
      "accessibility_review"
    ],
    "platforms": [
      "platform_neutral"
    ],
    "cost": "not_applicable",
    "privacy": "local",
    "equivalence": null,
    "purpose": "Organized reference for web accessibility criteria and techniques.",
    "limitations": [
      "reading guidance does not establish accessibility conformance",
      "Source purpose reviewed only; no integration or demonstrated project benefit is certified."
    ],
    "review_status": "reviewed",
    "review_revision": "purpose-review-2026-09-18",
    "reviewed_at": 1789689600,
    "fresh_for_seconds": 2592000,
    "license_scope": "Link and original short metadata only. Upstream content is not redistributed; resource-specific license permission must be checked before adoption.",
    "adoption_mode": "reference_only"
  },
  {
    "id": "playwright",
    "title": "Playwright documentation",
    "kind": "documentation",
    "source": "https://playwright.dev/docs/intro",
    "needs": [
      "interface_review",
      "reproducible_evaluation"
    ],
    "platforms": [
      "platform_neutral"
    ],
    "cost": "not_applicable",
    "privacy": "local",
    "equivalence": null,
    "purpose": "Browser-testing documentation with test runner and setup guidance.",
    "limitations": [
      "browser downloads and test side effects require explicit setup and isolated targets",
      "Source purpose reviewed only; no integration or demonstrated project benefit is certified."
    ],
    "review_status": "reviewed",
    "review_revision": "purpose-review-2026-09-18",
    "reviewed_at": 1789689600,
    "fresh_for_seconds": 2592000,
    "license_scope": "Link and original short metadata only. Upstream content is not redistributed; resource-specific license permission must be checked before adoption.",
    "adoption_mode": "reference_only"
  },
  {
    "id": "doppler-cli",
    "title": "Doppler CLI documentation",
    "kind": "documentation",
    "source": "https://docs.doppler.com/docs/cli",
    "needs": [
      "credential_location"
    ],
    "platforms": [
      "platform_neutral"
    ],
    "cost": "not_applicable",
    "privacy": "local",
    "equivalence": null,
    "purpose": "Documents command-line integration with Doppler-managed secrets.",
    "limitations": [
      "Workstation stores references only; provider commands and paid plan applicability are not certified",
      "Source purpose reviewed only; no integration or demonstrated project benefit is certified."
    ],
    "review_status": "reviewed",
    "review_revision": "purpose-review-2026-09-18",
    "reviewed_at": 1789689600,
    "fresh_for_seconds": 2592000,
    "license_scope": "Link and original short metadata only. Upstream content is not redistributed; resource-specific license permission must be checked before adoption.",
    "adoption_mode": "reference_only"
  },
  {
    "id": "onepassword-references",
    "title": "1Password secret references",
    "kind": "documentation",
    "source": "https://developer.1password.com/docs/cli/secret-references",
    "needs": [
      "credential_location"
    ],
    "platforms": [
      "platform_neutral"
    ],
    "cost": "not_applicable",
    "privacy": "local",
    "equivalence": null,
    "purpose": "Documents references that identify stored secrets without embedding values.",
    "limitations": [
      "reference syntax does not grant access or prevent same-user command exfiltration",
      "Source purpose reviewed only; no integration or demonstrated project benefit is certified."
    ],
    "review_status": "reviewed",
    "review_revision": "purpose-review-2026-09-18",
    "reviewed_at": 1789689600,
    "fresh_for_seconds": 2592000,
    "license_scope": "Link and original short metadata only. Upstream content is not redistributed; resource-specific license permission must be checked before adoption.",
    "adoption_mode": "reference_only"
  },
  {
    "id": "infisical",
    "title": "Infisical",
    "kind": "tool",
    "source": "https://github.com/Infisical/infisical",
    "needs": [